topic_letter,topic_id,top_terms,gloss,ord
A,5,"marvels, adam, bowed, dog, invents, compelled, appointment, plague, quails, manna",marvels,1
B,4,"ishmael, joseph, zechariah, jacob, outcast, john, prison, approve, job, patriarchs",ishmael,2
C,1,"fight, possessions, loves, hypocrites, treaty, orphans, needy, month, relatives, cursed",fight,3
D,0,"appear, delivers, godit, pathways, intercessor, evils, rejection, rejoice, ha, bounties",appear,13
E,2,"magicians, shuaib, saleh, hud, lot, threaten, dwellings, payment, ark, safe",magicians,16
F,3,"reality, proceed, lamp, early, cup, ordeal, deprived, blame, unleashed, beggar",reality,26
